"Sample_id","Institution_specimen_id","Spp_code","new_id","primary_collector","collector_lastname","collector_firstname","collector_full_string","collector_string","location_string","Country","State","County_fixed","County","Municipality","Locality","hand_georef_lat","hand_georef_lon","year","month","day","tissue_type","seed_scored","seed_eplus","Endo_status_liberal","Endo_status_conservative","Date_scored","scorer_id","score_number","surface_area_cm2","mean_infl_length","mean_inflplusawn_length","infl_count","scorer_factor","collector_factor","county_label","lon","lat","type","loctype","address","north","south","east","west","Herb_code","spp_code","specimen_code","tissue_code"
"BRIT_AGPE_64","BRIT442896","AGPE","BRIT442896",NA,NA,NA,"NA NA",NA,"Montgomery County, Arkansas, USA","USA","Arkansas","Montgomery County","Montgomery",NA,NA,NA,NA,2016,NA,NA,"seed",5,5,1,1,"10/29/2020","LaniDufresne",1,NA,NA,NA,NA,"Scorer19",NA," County",-93.6623239,34.5424074,"administrative_area_level_2","approximate","montgomery county, ar, usa",34.7466051,34.339467,-93.3939459,-93.9354349,"BRIT","AGPE",64,NA
"LL_AGHY_82","LL00496184","AGHY","00496184","William R. Carr","Carr","William","William Carr","W Carr","Bastrop County, Texas, United States","United States","Texas","Bastrop County","Bastrop",NA,"N side of an E-W stretch of Park Road 1-C, ca. 0.5-0.6 airmiles E of jct. Ann Powell Road (Co. Rd. 174), Buescher State Park.",30.05403,-97.16664,2016,4,14,"seed",5,0,0,0,"10/01/2019","LaniDufresne",1,NA,NA,NA,NA,"Scorer19","Collector885"," County",-97.3516558,30.0458708,"administrative_area_level_2","approximate","bastrop county, tx, usa",30.4196421,29.786541,-97.024461,-97.64937,"LL","AGHY",82,NA
"LL_ELVI_101","00499747","ELVI","00499747","William R. Carr","Carr","William","William Carr","W Carr","Bastrop County, Texas, United States","United States","Texas","Bastrop County","Bastrop",NA,"W side of paved road on W side Buescher Lake, ca. 0.6 airmiles N of jct. St. Rt. 71 and F.M. 153, SW edge of Buescher State Park.",30.04236,-97.15903,2016,6,16,"seed",4,0,0,0,"7/15/21","ArinzeAppio-Riley",1,NA,NA,NA,NA,"Scorer1","Collector885"," County",-97.3516558,30.0458708,"administrative_area_level_2","approximate","bastrop county, tx, usa",30.4196421,29.786541,-97.024461,-97.64937,"LL","ELVI",101,NA
"LL_ELVI_48","00496525","ELVI","00496525","William R. Carr","Carr","William","William Carr","W Carr","Goliad County, Texas, United States","United States","Texas","Goliad County","Goliad",NA,"E edge of parking area for Vaquero Campground, W side of San Antonio River ca. 0.25 airmiles NW of US Rt. 183 bridge, SW part of Goliad State Park.",28.65208,-97.38781,2016,5,6,"seed",6,1,1,1,"7/7/21","ArinzeAppio-Riley",1,NA,NA,NA,NA,"Scorer1","Collector885"," County",-97.3516558,28.5673709,"administrative_area_level_2","approximate","goliad county, tx, usa",28.925316,28.388684,-97.153588,-97.7785301,"LL","ELVI",48,NA
"LL_ELVI_48","00496525","ELVI","00496525","William R. Carr","Carr","William","William Carr","W Carr","Goliad County, Texas, United States","United States","Texas","Goliad County","Goliad",NA,"E edge of parking area for Vaquero Campground, W side of San Antonio River ca. 0.25 airmiles NW of US Rt. 183 bridge, SW part of Goliad State Park.",28.65208,-97.38781,2016,5,6,"seed",4,1,1,1,"11/8/2021","AvaJohnson",2,NA,NA,NA,NA,"Scorer2","Collector885"," County",-97.3516558,28.5673709,"administrative_area_level_2","approximate","goliad county, tx, usa",28.925316,28.388684,-97.153588,-97.7785301,"LL","ELVI",48,NA
"MO_AGHY_104","AEBrant8210","AGHY","EBrant8210","A. E. Brant","Brant","A.","A. Brant","A Brant","Sand Pond Conservation Area, Ripley County, Missouri, USA","USA","Missouri","Ripley County","Ripley","Sand Pond Conservation Area","Sand Pond Conservation Area Botanical Survey; Sandy openings and hardwood forest north of County Rd. W3 and west of hiking trail to Pond Berry preserve.",NA,NA,2016,6,7,"seed",4,0,0,0,"4/26/2023","ChrisOxley",1,NA,NA,NA,NA,"Scorer6","Collector9"," County",-90.5991042,36.5025468,"establishment","geometric_center","sand pond conservation area, neelyville, mo 63954, usa",36.5109508,36.4984525,-90.5938827,-90.612276,"MO","AGHY",104,NA
"OKL_ELVI_62","OKL274906;20010351;HB-069","ELVI","OKL274906","Amy Buthod ","Buthod","Amy","Amy Buthod","A Buthod","Antlers, Atoka County, Oklahoma, USA","USA","Oklahoma","Atoka County","Atoka","Antlers","Antlers; W of Antlers at the The Nature Conservancy's Hottonia Bottoms Nature Preserve. Ca. 34.156595* -95.953698*. Uland forest, Quercus phellos/Q. nigra forest. Wetland status: FAC; With Cryptoteania canadensis, Hypericum hypericoides, Zanthoxylum clava-herculis.",NA,NA,2016,7,20,"seed",5,0,0,0,"7/28/2022","MalloryTucker",1,NA,NA,NA,NA,"Scorer20","Collector11"," County",-95.9832577,34.4509901,"administrative_area_level_2","approximate","atoka county, ok, usa",34.680565,34.1565559,-95.6717499,-96.407517,"OKL","ELVI",62,NA
